{
  "case_id": "pos-08d7d9b6-3bb7-4b27-8a15-2646537dbfdb",
  "claim": {
    "claimed_effect": "EFFECT_VERIFIED",
    "proposal_id": "08d7d9b6-3bb7-4b27-8a15-2646537dbfdb",
    "setpoint_c": 20.0,
    "tool": "set_zone_setpoint",
    "zone_id": "ZONE-01"
  },
  "decision": {
    "approved": true,
    "decision": "verify",
    "reasons": [
      "authority_resolved_review"
    ],
    "reviewer": {
      "approved": true,
      "model": "careful",
      "reason": "matches today's plan and the strategy's step"
    }
  },
  "evidence_sha256": "a53b1b1e568225b4160dbe7efc25784ec995dfe83cce5aa06eb9c335be5f3a33",
  "execution": {
    "dispatched_at_sim_s": 428400,
    "executed": true,
    "executions": 1
  },
  "fault": null,
  "kind": "positive",
  "observation": {
    "observed_at_sim_s": 428400,
    "observed_setpoint_c": 20.0
  },
  "remora_envelope": {
    "assessment": {
      "evidence_quality": {},
      "oracle_votes": [],
      "policy_triggers": [
        "authority_resolved_review"
      ],
      "thermodynamic": {}
    },
    "audit": {
      "actor_identity": "ot-agent",
      "data_classification": null,
      "hash": "4434682f57ad758d8d26bb0227f517d2d24ecacaa7cb5683afd5b909e2f4e43a",
      "intent_authority_hash": "27d0a67cbabde6ec80d105f08b45d2275f9517de93611669beb92a7603fc4626",
      "policy_bundle_hash": null,
      "policy_version": "RemoraDecisionEngine-v6",
      "previous_hash": null,
      "retention_policy": null,
      "schema_version": "2",
      "signature": null,
      "tenant_id": "ot-pilot",
      "timestamp_utc": null,
      "tool_args_hash": "c20fc2fca7b63cf4ad7c7b9de3480f2c59df8e5eb3bfd1ebe8a263b70eed83dc",
      "tool_contract_bundle_hash": "31fa78528025d93725c2853c05474bdea34c31ac9b5b9b23f7cf6607930e471b"
    },
    "causal_explanation": null,
    "effect": {
      "effect_outcome": "EFFECT_CLAIMED",
      "executed": true,
      "ledger_entry": {
        "effect_scope": "declared_delta_only",
        "effect_status": "EFFECT_VERIFIED",
        "effect_vantage": "same_deployment",
        "effect_verdict_source": "claimed",
        "effect_verifier_identity": "ot-effect-observer/v1",
        "entry_hash": "3a397d63d0279dca1f7758810e0f8942c1d08e45f072457a21d6814586acd21c",
        "grant_jti": "6f85997b-a0af-4084-8373-110dacdf543a",
        "outbox_id": "8a44c1b7-37dd-4ad1-8508-3ac809beb6ee",
        "outbox_state": "SUCCEEDED",
        "sequence_no": 496
      },
      "tool_call_hash": "c20fc2fca7b63cf4ad7c7b9de3480f2c59df8e5eb3bfd1ebe8a263b70eed83dc"
    },
    "follow_up": {
      "requested_evidence": [],
      "required": false,
      "sla_hours": null,
      "type": null
    },
    "gate": {
      "allowed_next_steps": [],
      "blocked_action": null,
      "outcome": "verify"
    },
    "history": {
      "decision_pattern": {},
      "known_blockers": [],
      "similar_cases_found": 0,
      "synthetic": true
    },
    "policy_learning": {
      "candidate_rule_update": false,
      "requires_policy_owner_approval": true
    },
    "request": {
      "action_type": "",
      "domain": "",
      "proposed_action": "set_zone_setpoint",
      "request_id": "08d7d9b6-3bb7-4b27-8a15-2646537dbfdb",
      "risk_tier": "",
      "target_environment": "simulated_pilot"
    },
    "reviewer_context": {
      "asset": {},
      "missing_critical_data": []
    }
  },
  "remora_evidence": {
    "audit_verification": {
      "problems": [],
      "records_checked": 498,
      "valid": true
    },
    "capability_decision": {
      "decisions": [],
      "latest": null
    },
    "effect_verification": {
      "effect_state": "EFFECT_CLAIMED",
      "expected_sha256": "983340c8e5e7e7d575db49a8795f6f1a4d671acf772b64d9e301464392accadd",
      "history": [
        {
          "actor": "ot-effect-observer",
          "detail": "",
          "dispatch_id": "6f85997b-a0af-4084-8373-110dacdf543a",
          "event": "effect_verified",
          "evidence_refs": [
            "verdict:claimed"
          ],
          "execution_id": "08d7d9b6-3bb7-4b27-8a15-2646537dbfdb",
          "expected": {},
          "expected_sha256": "983340c8e5e7e7d575db49a8795f6f1a4d671acf772b64d9e301464392accadd",
          "observed": {},
          "observed_sha256": "983340c8e5e7e7d575db49a8795f6f1a4d671acf772b64d9e301464392accadd",
          "observed_state_hash": "",
          "proposal_id": "08d7d9b6-3bb7-4b27-8a15-2646537dbfdb",
          "reason_code": "postcondition_verified",
          "scope": "declared_delta_only",
          "status": "EFFECT_VERIFIED",
          "submitted_by": "ot-effect-observer",
          "tool_call_hash": "c20fc2fca7b63cf4ad7c7b9de3480f2c59df8e5eb3bfd1ebe8a263b70eed83dc",
          "tool_id": "set_zone_setpoint",
          "toolspec_hash": "7bfb06fc75189e6dd0cf6448300bab12acd83ff681395803d945784c62e1a9f3",
          "vantage": "same_deployment",
          "verified_at": "2026-10-27T10:55:12.817056+00:00",
          "verifier_identity": "ot-effect-observer/v1",
          "verifier_version": ""
        }
      ],
      "observed_sha256": "983340c8e5e7e7d575db49a8795f6f1a4d671acf772b64d9e301464392accadd",
      "reason_code": "postcondition_verified",
      "scope": "declared_delta_only",
      "self_attested": false,
      "status": "EFFECT_VERIFIED",
      "vantage": "same_deployment",
      "vantage_recorded": true,
      "verdict_source": "claimed",
      "verified_at": "2026-10-27T10:55:12.817056+00:00",
      "verifier_identity": "ot-effect-observer/v1"
    },
    "evidence_coverage": {
      "authorized_execution_v1": {
        "contract_id": "authorized_execution_v1",
        "missing": [],
        "satisfied": [
          "assessed",
          "execution_authorized",
          "execution_result[tool_executed=True]"
        ],
        "status": "COMPLETE",
        "tampered": [],
        "unverifiable": []
      },
      "executed_effect_v1": {
        "contract_id": "executed_effect_v1",
        "missing": [],
        "satisfied": [
          "assessed",
          "execution_authorized",
          "execution_result[tool_executed=True]",
          "effect_verified[status=EFFECT_VERIFIED]"
        ],
        "status": "COMPLETE",
        "tampered": [],
        "unverifiable": []
      },
      "success_established_v1": {
        "contract_id": "success_established_v1",
        "missing": [
          "assessed[capability.allowed=True]"
        ],
        "satisfied": [
          "execution_authorized",
          "execution_result[tool_executed=True]",
          "effect_verified[status=EFFECT_VERIFIED]"
        ],
        "status": "AUTHENTIC_BUT_INCOMPLETE",
        "tampered": [],
        "unverifiable": []
      },
      "success_established_v2": {
        "contract_id": "success_established_v2",
        "missing": [
          "assessed[capability.allowed=True]"
        ],
        "satisfied": [
          "execution_authorized",
          "execution_result[nested_effects.settled=True,tool_executed=True]",
          "effect_verified[status=EFFECT_VERIFIED]"
        ],
        "status": "AUTHENTIC_BUT_INCOMPLETE",
        "tampered": [],
        "unverifiable": []
      }
    },
    "lifecycle": {
      "dispatch": {
        "attempt_no": 1,
        "detail": null,
        "outbox_id": "8a44c1b7-37dd-4ad1-8508-3ac809beb6ee",
        "state": "SUCCEEDED",
        "terminal": true,
        "worker_id": "api:1"
      },
      "events": [
        {
          "actor": "ot-agent",
          "entry_hash": "e9ef335f2277b67a27d53625635bef6e7641c1c953267d115a6bdd1f6f742b2e",
          "event": "assessed",
          "payload": {
            "actor": "ot-agent",
            "decision": "verify",
            "event": "assessed",
            "intent_authority_hash": "27d0a67cbabde6ec80d105f08b45d2275f9517de93611669beb92a7603fc4626",
            "intent_resolution_status": "resolved",
            "limits_policy_hash": "sha256:8141cf4b73571fefd132d7fa90a904fbe1445a8f8c28c17be40e92cdaa8887d2",
            "lineage": {
              "escalation_eligible": false,
              "lineage_key_basis": "semantic_target",
              "prior_abstain_count": 0,
              "probe_sequence_no": 1,
              "shadow_only": true,
              "superseded_proposal_id": "",
              "window_seconds": 3600
            },
            "lineage_resource": "ZONE-01",
            "policy_version": "RemoraDecisionEngine-v6",
            "proposal_envelope_hash": "f710d45018e17b7bd5b0032c3e648a1d57305c4a2866c5c306fc9dc92dc642be",
            "proposal_id": "08d7d9b6-3bb7-4b27-8a15-2646537dbfdb",
            "reasons": [
              "authority_resolved_review"
            ],
            "review_item_id": "82dff662-5788-4089-b618-436b6566ebd9",
            "state_hash": "e99afb3173b0d0fdcf8c3b085b225b1dab56eea5d84e45b6bae5a7c7f9ef7769",
            "superseded_proposal_id": "",
            "target_environment": "simulated_pilot",
            "tool_call_hash": "c20fc2fca7b63cf4ad7c7b9de3480f2c59df8e5eb3bfd1ebe8a263b70eed83dc",
            "tool_contract_bundle_hash": "31fa78528025d93725c2853c05474bdea34c31ac9b5b9b23f7cf6607930e471b",
            "tool_name": "set_zone_setpoint",
            "toolspec_hash": "7bfb06fc75189e6dd0cf6448300bab12acd83ff681395803d945784c62e1a9f3",
            "toolspec_version": 1
          },
          "sequence_no": 493,
          "timestamp": "2026-10-27T10:55:10.373414+00:00"
        },
        {
          "actor": "ot-approver",
          "entry_hash": "eb32d49b233c1ed17c1ff2e9f9901b9892016502e2024798c1ccce482e92f4b1",
          "event": "approved",
          "payload": {
            "actor": "ot-approver",